{
  "$schema": "./workflow.schema.json",
  "version": 1,
  "agents": {
    "disabled": [],
    "custom": {}
  },
  "gates": {
    "G1": {
      "name": "Clarify",
      "approves": "The user stories and their numbered acceptance criteria",
      "approver": "human"
    },
    "G2": {
      "name": "Refine / Align",
      "approves": "The frozen spec, read after the architecture narrative",
      "approver": "human"
    },
    "G3": {
      "name": "Plan",
      "approves": "The task plan",
      "approver": "human",
      "note": "The human may delegate this gate to the orchestrator for small plans."
    },
    "G4": {
      "name": "Approve",
      "approves": "The review report (not the diff)",
      "approver": "human"
    },
    "release": {
      "name": "Release go / no-go",
      "approves": "The product-owner's go / no-go on the release scope and the release-gate checklist",
      "approver": "human"
    }
  },
  "lifecycles": {
    "AI-DLC": {
      "name": "Full lifecycle",
      "kind": "primary",
      "pickWhen": "A feature, epic or idea must go from intent to release (the default for feature work)",
      "exitArtifact": "A released (or release-ready) feature, traceable brief -> stories / ACs -> ADRs / spec -> tasks -> code / tests / docs -> review report -> release notes",
      "segments": ["PDLC", "ASDLC", "STBLC", "FDLC", "Release"],
      "note": "Enter at the earliest missing artifact and run to the end. FDLC runs once per task or wave of tasks. Re-anchor on the frozen spec at every boundary after G2. Executed as request-routing Mode 4, full lifecycle traversal."
    },
    "PDLC": {
      "name": "Product Design",
      "kind": "segment",
      "pickWhen": "The input is a vague idea, epic or business goal",
      "exitArtifact": "Feature list, use-case diagrams, user stories with numbered ACs in docs/product/ and docs/backlog/backlog.md",
      "stages": [
        {
          "id": "brief",
          "agent": "product-owner",
          "produces": ["docs/product/<slug>/brief.md"],
          "after": [],
          "critique": true,
          "note": "Outcomes, features, use cases; returns a delegation list for requirement-analyst and product-manager."
        },
        {
          "id": "stories",
          "agent": "requirement-analyst",
          "skills": ["requirement-analysis"],
          "produces": ["User stories with testable, numbered ACs in docs/product/"],
          "critique": true,
          "note": "One question at a time until every story has testable, numbered ACs."
        },
        {
          "id": "backlog",
          "agent": "product-manager",
          "skills": ["product-planning"],
          "produces": ["docs/backlog/backlog.md"],
          "note": "Backlog entries with the priority the product-owner decided."
        },
        {
          "id": "accept",
          "agent": "product-owner",
          "produces": ["Acceptance of the stories and the backlog"],
          "gate": "G1",
          "loop": {
            "to": "stories",
            "on": "The product-owner sends the stories or the backlog back"
          }
        }
      ]
    },
    "ASDLC": {
      "name": "Architecture & Design",
      "kind": "segment",
      "pickWhen": "Stories exist but no agreed design / spec",
      "exitArtifact": "ADRs in docs/architecture/decisions/ plus a frozen docs/specs/<slug>.spec.md per story, co-owned by software-architect and system-engineer",
      "stages": [
        {
          "id": "architecture",
          "agent": "software-architect",
          "skills": ["architecture-design", "write-adr"],
          "produces": ["docs/architecture/decisions/"],
          "after": [],
          "critique": true,
          "note": "Each consequential decision becomes an ADR."
        },
        {
          "id": "research",
          "agent": "research-assistant",
          "skills": ["research"],
          "produces": ["Cited findings report"],
          "after": [],
          "when": "the design depends on an external fact (library, API, standard) the team has not verified",
          "note": "Runs in parallel with the architecture stage."
        },
        {
          "id": "low-level-design",
          "agent": "system-engineer",
          "skills": ["system-design"],
          "produces": ["Low-level design (modules, patterns, DI plan)"],
          "after": ["architecture", "research"]
        },
        {
          "id": "spec",
          "agent": "requirement-analyst",
          "skills": ["spec-driven-development"],
          "produces": ["docs/specs/<slug>.spec.md (status Frozen)"],
          "after": ["low-level-design"],
          "critique": true,
          "note": "software-architect and system-engineer co-sign the spec; it is then frozen. Changes after freezing go back through this stage."
        },
        {
          "id": "narrative",
          "agent": "software-architect",
          "skills": ["architecture-narrative"],
          "produces": ["docs/architecture/narratives/<slug>.md"],
          "after": ["spec"],
          "critique": true,
          "gate": "G2",
          "note": "The three-act story (problem -> constraints and trade-offs -> design, ADRs, risks), written for the human who approves G2."
        }
      ]
    },
    "STBLC": {
      "name": "Story & Task Breakdown",
      "kind": "segment",
      "pickWhen": "A frozen spec exists but no task plan",
      "exitArtifact": "docs/plans/<slug>.tasks.md: estimated, dependency-ordered tasks, each with its own technical Definition of Done",
      "stages": [
        {
          "id": "split",
          "agent": "software-architect",
          "produces": ["docs/plans/<slug>.tasks.md (draft)"],
          "after": [],
          "note": "Splits the frozen spec into tasks; each task records id, AC references, dependencies, estimate and technical DoD."
        },
        {
          "id": "split-design",
          "agent": "system-engineer",
          "produces": ["docs/plans/<slug>.tasks.md (task boundaries refined)"],
          "note": "Co-splits with software-architect at the low-level design boundaries."
        },
        {
          "id": "estimate",
          "agent": "software-engineer",
          "produces": ["Estimates and flagged unknowns in the task plan"]
        },
        {
          "id": "order",
          "agent": "product-owner",
          "produces": ["docs/plans/<slug>.tasks.md (ordered by priority)"],
          "critique": true,
          "gate": "G3"
        }
      ]
    },
    "FDLC": {
      "name": "Feature Development",
      "kind": "segment",
      "pickWhen": "Tasks exist and code must land",
      "exitArtifact": "Merge-ready change: code, tests, docs, review report with zero Blockers",
      "note": "The build loop. Runs once per task or wave of tasks.",
      "stages": [
        {
          "id": "build",
          "agent": "software-engineer",
          "skills": ["implement-feature"],
          "produces": ["Implementation diff", "Green build and tests (the project's commands)"],
          "after": [],
          "note": "Every behaviour traces to a numbered AC; anything outside the spec goes back to ASDLC."
        },
        {
          "id": "ui-tests",
          "agent": "sqa-engineer",
          "skills": ["playwright-mcp-ui-testing"],
          "produces": ["Browser test report", "tests/screenshots/"],
          "after": ["build"],
          "when": "the change touches UI / frontend",
          "note": "AI-driven UI tests run through the Playwright MCP tools."
        },
        {
          "id": "tests",
          "agent": "sqa-engineer",
          "skills": ["design-test-cases", "write-tests"],
          "produces": ["Test suite", "AC-traceability table", "Mutation report"],
          "after": ["build"],
          "loop": {
            "to": "build",
            "on": "A test or the mutation run reveals a defect in production code (Quality Check & Refinement)"
          },
          "note": "Also the stack's unit, integration, UI and mutation-testing skills (csharp-* or ts-*). Unit, integration and UI suites may fan out to parallel sqa-engineer instances."
        },
        {
          "id": "docs",
          "agent": "documentation-writer",
          "skills": ["write-documentation"],
          "produces": ["Updated README.md files for every changed component"],
          "after": ["build"],
          "critique": true
        },
        {
          "id": "architecture-review",
          "agent": "software-architect",
          "skills": ["architecture-review"],
          "produces": ["Architecture conformance findings"],
          "after": ["ui-tests", "tests", "docs"],
          "loop": {
            "to": "build",
            "on": "The change does not conform to the ADRs or the spec (Architecture Conformance)"
          }
        },
        {
          "id": "review",
          "agent": "code-reviewer",
          "skills": ["review"],
          "produces": ["Severity-ranked findings report with zero Blockers"],
          "after": ["architecture-review"],
          "gate": "G4",
          "loop": {
            "to": "build",
            "on": "Blockers in the review report; Blockers in test code go to the tests stage (Code Audit & Refinement)"
          },
          "note": "Fanned out to one code-reviewer per review axis."
        }
      ]
    },
    "BFLC": {
      "name": "Bug Fixing",
      "kind": "focused",
      "pickWhen": "Incorrect behaviour, failing test, regression",
      "exitArtifact": "Root cause statement, minimal fix, a regression test that failed before and passes after",
      "stages": [
        {
          "id": "root-cause",
          "agent": "software-engineer",
          "skills": ["fix-bug"],
          "produces": ["Root cause statement with file:line"],
          "after": [],
          "note": "fix-bug Phase 1 only. research-assistant if external behaviour is involved; software-architect if the cause is architectural."